,title,text,url
15,Internship Project Management (all genders) #work&study #agile #projectmanagement #addvalue,"We are part of Erste Group - the largest banking group in Central and Eastern Europe with more than 2,500 branches and over 45,000 employees. Our more than 2,000 IT experts and enthusiasts are the bank's Digital Muscle. Internship Project Management (all genders) #work&study #agile #projectmanagement #addvalue Location: Vienna Working-Hours: Part-time Occupation Area: IT Company: Erste Digital With top notch technology, we drive the realization offers the Group's vision: To provide human banking in digital times, and to build Financial Health for over 16 million customers in the CEE region. We aim to attract and develop the best talent and aspire to be an IT employer beyond compare. We are Erste Digital. We are #digitaltotheheart This position is within the risk management area, more specifically we are responsible for loan application and risk steering functionalities. Thus, we are direct contributors to Erste's mission on fostering financial health for everybody in our region. Apart from seeing a direct impact in our everyday work, the team is driving the ambition towards digitalization in Erste Bank and Sparkassen. After your internship you learned in practice how to structure problems and take action to solve them. In addition, this position is also going to help you to communicate effectively with all audiences in a structured manner. What is more, is the development and strengths of your working style and personal values. What to do: Prepare meetings, including gathering of additional information, conducting analysis, presenting arguments, making sense of complex documents, understanding perspectives of involved stakeholders Organize a smooth daily work routine (e. g. appointments) and support the team in overseeing finance and controlling topics Drive selected initiatives and events on behalf of the department Ensure that documents and information meet high quality standards, can be easily understood, and contain all necessary and relevant information Support in maintaining the regular communication with key stakeholders Assist with data administration, e-mails, and other communication You check these boxes: Enrolled Master's student with on-going program at university (Uni, FH) Self-management and time management Empathy and trustworthiness Strategic and growth mindset, with a flavor of humor Analytical skills and an eye for details Knowledge of IT and/ or lending products or the curiousness to grow further in one of the areas Appreciative communication and passion for teamwork and continuous learning Fluent in English and German Why you will like us: Possibility to benefit and learn from our international, talented and passionate community at Erste. Great learning curve through ownership and creative freedom. Interest groups and clubs: Take part in discussions and get involved in projects. Numerous interest groups invite you to engage with a topic. Good food: Healthy nutrition and good food are important for our quality of life. With seven restaurants and cafeterias, there's something to suit every taste on the Erste Campus. Health Centre - The Erste Campus operates a fully equipped health centre that offers all employees a high standard of medical services during working hours. New way of work: With our flexible working hours model we want to make your life less complicated. Combing the best of both worlds, remote and company time. Discover all our benefits of Erste group here - Thanks to our corporate benefits partners, you can also receive a whole bunch of discounts in different areas. We offer you a varied part-time internship position (20-30h/week) for 12 months. An internship salary of EUR 2.854,-- gross per month (on a full-time basis) is offered. Erste Group considers the diversity of its employees as key to innovation and success. As employer we are proud to offer everyone equal chances, irrespective of age, skin colour, religious belief, gender, sexual orientation or origin. Apply online Jetzt bewerben",https://www.itstellen.at/j/6596048
16,Studentenjob (w/m/x) – Programming Support in Export & Investment Finance (25 h/Woche),"Studentenjob (w/m/x) - Programming Support in Export & Investment Finance (25 h/Woche)
Wir, die Abteilung Export & Investment Finance, beschäftigen uns mit Finanzierungen die im Zusammenhang mit nationalen und internationalen Förderungen stehen. Zur Unterstützung unseres „International Business Teams"" suchen wir eine:n motivierte:n Student:in (m/w/x) für 25 Wochenstunden. Idealerweise bist du bis zur Beendigung deines Studiums (ca. 2-3 Jahre) verfügbar. start so bald
wie möglich teilzeit
(25 h/Woche) viennaoffice Deine Rolle bei uns im Team Unterstützung bei der Wartung, Anpassung und Weiterentwicklung von bestehenden Excel-Applikationen Entwicklung von maßgeschneiderten IT-Lösungen auf Basis von Visual Basic for Applications (VBA) Unterstützung bei Datenanalysen und Datenqualitätsmanagement Unterstützung bei der Abwicklung von geförderten Finanzierungsanträgen Mithilfe bei organisatorischen und administrativen Tätigkeiten Du bist bei uns richtig, wenn ... Du aktuell ein Studium mit wirtschaftlichem Bezug absolvierst (BWL, Wirtschaftsinformatik, Finanzmathematik oä.) Du ausgezeichnete Deutsch- und Englisch-Kenntnisse besitzt Du sehr gute MS Office Kenntnisse besitzt (speziell Excel) Du Programmierkenntnisse mitbringst (VBA, Python, Java etc.) Klingt gut? Trifft auch Folgendes zu? Du hast ein gutes analytisches Verständnis Du zeigst gerne Eigeninitiative und hast eine schnelles Aufnahmevermögen Du zeichnest dich durch Flexibilität und Genauigkeit aus Du lernst gerne Neues und entwickelst dich ständig weiter Das können wir dir bieten Work & Study: sammle Praxiserfahrung im internationalen Bankenumfeld & bessere dein Student:innenkonto auf Flexibilität: teile dir deine Wochenstunden optimal ein und arbeite abwechselnd von zu Hause und vom Büro aus Onboarding: genieße einen unbeschwerten Einstieg - ein Buddy aus deinem Team steht dir zur Seite Community: nütze die Möglichkeit und vernetze dich intern mit anderen Studierenden Gaumenfreuden: in unserer gesunden und stark geförderten Kantine Corporate Benefits: Rabatte beim Einkaufen, gratis Museumtickets, vielfältige Sportangebote, reduzierte Mitgliedschaft im Fitnesscenter, Jobticket u.v.m. Monatsbrutto EUR 2.049,64 (Basis für 38,5 Stunden) Du möchtest wissen, wie es ist, neben dem Studium bei der RBI zu arbeiten? Schau dir an, was deine zukünftigen Kolleg:innen zu berichten haben - hier geht's zu unseren Videos. Als Raiffeisen Bank International zählen wir über 17 Millionen Kund:innen in Österreich und 12 weiteren Ländern in Zentral- und Osteuropa. Diesen Erfolg haben wir unseren talentierten Mitarbeiter:innen zu verdanken. Wir sind stets bemüht ein Arbeitsfeld zu schaffen, in dem sich jede:r entfalten kann. Diversität und Inklusion sind wesentliche Bestandteile unserer Vision und Mission und spiegeln sich in unseren Werten wider: Zusammenarbeit, Proaktivität, Lernen und Verantwortung. Unser gemeinsames Ziel ist es, ein hervorragendes Kundenerlebnis zu bieten. Bei Fragen bezüglich des Bewerbungsprozesses, wirf gerne einen Blick auf unsere Website oder unsere FAQ. Dein Bewerbungsschreiben kannst du an Christina Stolz richten. Folge unserem RBI Account auf LinkedIn! Jetzt bewerben",https://www.itstellen.at/j/6599753
